permission_df,filter_code
if New pink line alert (trigger_service: Chicago Transit Authority) then Post to channel (action_service: Slack),"var Hour = Meta.currentUserTime.hour() var Day = Meta.currentUserTime.day()   if (Hour <7 || Hour > 10) {   Slack.postToChannel.skip(""Outside of morning commuting hours"") }   if (Day == 6 || Day == 7) {   Slack.postToChannel.skip(""Not a weekday"") }"
if New bus advisory (trigger_service: NJ Transit) then Send a notification from the IFTTT app (action_service: Notifications),"var Hour = Meta.currentUserTime.hour() var Day = Meta.currentUserTime.day()  if (Day==6 || Day==7) {   IfNotifications.sendNotification.skip(""Not a weekday"") }  else if (Hour < 7 || (Hour > 9 && Hour < 5) || Hour > 19) {   IfNotifications.sendNotification.skip(""Not commuting hours"") }"
if New DART rider alert (trigger_service: DART) then Send a notification from the IFTTT app (action_service: Notifications),"var Hour = Meta.currentUserTime.hour() var Day = Meta.currentUserTime.day()   if (Hour <7 || (Hour > 10 && Hour < 17) || Hour > 19) {   IfNotifications.sendNotification.skip(""Outside of commuting hours"") }   if (Day == 6 || Day == 7) {   IfNotifications.sendNotification.skip(""Not a weekday"") }"
if New tweet by a specific user (trigger_service: Twitter) then Send a notification from the IFTTT app (action_service: Notifications),"if (Twitter.newTweetByUser.Text.indexOf(""SNES"") < 0   && Twitter.newTweetByUser.Text.indexOf(""Super NES"") < 0   && Twitter.newTweetByUser.Text.indexOf(""Super Nintendo"") < 0) {     IfNotifications.sendNotification.skip() }"
if New feed item (trigger_service: RSS Feed) then Post a tweet (action_service: Twitter),"if(Feed.newFeedItem.EntryContent.indexOf(""@"") > 0)  {    Twitter.postNewTweet.skip();  }"
if Any card purchase (trigger_service: Monzo) then Move money out of a pot (action_service: Monzo),"if ( Monzo.cardPurchase.Category == ""Transport"" ) {    Monzo.potWithdraw.setAmount(Monzo.cardPurchase.AmountInAccountCurrency)  } else {    Monzo.potWithdraw.skip(""Not a Transport Purchase"")  }"
if Any card purchase (trigger_service: Monzo) then Move money out of a pot (action_service: Monzo),"if ( Monzo.cardPurchase.Category == ""Entertainment"" ) {    Monzo.potWithdraw.setAmount(Monzo.cardPurchase.AmountInAccountCurrency)  } else {    Monzo.potWithdraw.skip(""Not an Entertainment Purchase"")  }"
if Any card purchase (trigger_service: Monzo) then Move money out of a pot (action_service: Monzo),"if ( Monzo.cardPurchase.Category == ""Eating Out"" ) {    Monzo.potWithdraw.setAmount(Monzo.cardPurchase.AmountInAccountCurrency)  } else {    Monzo.potWithdraw.skip(""Not an Eating Out Purchase"")  }"
if Any card purchase (trigger_service: Monzo) then Move money out of a pot (action_service: Monzo),if (Monzo.cardPurchase.AccountCurrencyCode == Monzo.cardPurchase.LocalCurrencyCode) {   Monzo.potWithdraw.skip(); }  Monzo.potWithdraw.setAmount(Monzo.cardPurchase.AmountInAccountCurrency)
if Any card purchase (trigger_service: Monzo) then Move money out of a pot (action_service: Monzo),"var Merchant = Monzo.cardPurchase.MerchantName  var Currency = Monzo.cardPurchase.LocalCurrencyCode  var ForeignMerchants = ['atm'];  var CurrencyCode = ['gbp'];     if ((CurrencyCode.indexOf(Currency.toLowerCase()) > -1) || (ForeignMerchants.indexOf(Merchant.toLowerCase()) == -1)) {       Monzo.potWithdraw.skip(""Not a #TravelMoney purchase"")  }"
if Every day at (trigger_service: Date & Time) then Move money into a pot (action_service: Monzo),"var momentObject = Meta.currentUserTime  var date_of_month = momentObject.date() var month = momentObject.month() + 1 var year = Number(momentObject.format(""YY""))  var depositAmount = ((date_of_month + month + year) / 100).toFixed(2) var depositAmountString = depositAmount.toString()  Monzo.potDeposit.setAmount(depositAmountString);"
if Any card purchase (trigger_service: Monzo) then Move money into a pot (action_service: Monzo),var amount = parseFloat(Monzo.cardPurchase.AmountInAccountCurrency); var c = Math.ceil(amount); var remainder = c - amount; var roundedRemainder = remainder.toFixed(2); if (amount > 0 && remainder > 0) {   Monzo.potDeposit.setAmount(roundedRemainder); }
if Any card purchase (trigger_service: Monzo) then Move money into a pot (action_service: Monzo),var amount = parseFloat(Monzo.cardPurchase.AmountInAccountCurrency); var remainder = (Math.ceil(amount*2)/2) - amount var roundedRemainder = remainder.toFixed(2); if (amount > 0 && remainder > 0) {   Monzo.potDeposit.setAmount(roundedRemainder); }
if Any card purchase (trigger_service: Monzo) then Move money into a pot (action_service: Monzo),"var saveAmount = 10 - parseInt(Monzo.cardPurchase.AmountInAccountCurrency.slice(-1))  Monzo.potDeposit.setAmount(""0.0"" + saveAmount.toString())"
if Every day at (trigger_service: Date & Time) then Move money into a pot (action_service: Monzo),var day_of_year = Meta.currentUserTime.format('DDD'); var amount = parseInt(day_of_year) / 100; Monzo.potDeposit.setAmount(amount.toFixed(2));
if New activity by you (trigger_service: Strava) then Move money out of a pot (action_service: Monzo),var distance = parseInt(Strava.newActivityByYou.DistanceMeters); var amount = distance/1000; Monzo.potWithdraw.setAmount(amount.toFixed(2));
if Card Spend Authorised (trigger_service: RoosterMoney) then Pot to pot transfer (action_service: RoosterMoney),const decimal = parseFloat(Roostermoney.cardSpend.SpendAmountDecimal); const rounded = Math.ceil(decimal * 10) / 10; const roundUp10p = ((rounded * 100) - (decimal * 100)) / 100; Roostermoney.transfer.setAmount(`${roundUp10p}`);
if New transfer (trigger_service: Stripe) then Move money into a pot (action_service: Monzo),Monzo.potDeposit.setAmount(String(parseFloat(Stripe.newTransfer.Amount) / 2))
if Current condition changes to (trigger_service: Weather Underground) then Change color (action_service: Philips Hue),let currentHour = Meta.currentUserTime.hour(); var day = Meta.currentUserTime.weekday();  if (currentHour < 5 || currentHour >= 9) {   Hue.setColorAllHue.skip()   IfNotifications.sendNotification.skip(); }  else if (day == 0) {      Hue.setColorAllHue.skip()   IfNotifications.sendNotification.skip(); }   else if (day == 6) {     Hue.setColorAllHue.skip()  IfNotifications.sendNotification.skip(); }
if New metro alert from King County Metro (trigger_service: King County Metro) then Post to channel (action_service: Slack),"var Hour = Meta.currentUserTime.hour()   if (Hour < 7 || Hour > 10) {   Slack.postToChannel.skip(""Outside of commuting hours"") }"
if New service alert on Rapid Ride A line (trigger_service: King County Metro) then Send me an email (action_service: Email),"var Hour = Meta.currentUserTime.hour()   if (Hour <7 || (Hour > 10 && Hour < 17) || Hour > 19) {   Email.sendMeEmail.skip(""Outside of commuting hours"") }"
if New service alert on Rapid Ride C line (trigger_service: King County Metro) then Send a notification from the IFTTT app (action_service: Notifications),"var Hour = Meta.currentUserTime.hour()  if (Hour < 7 || Hour > 10) {   IfNotifications.sendNotification.skip(""Not during the morning commute"") }"
if New service alert on Rapid Ride E line (trigger_service: King County Metro) then Send a notification from the IFTTT app (action_service: Notifications),"var Hour = Meta.currentUserTime.hour()   if (Hour <7 || (Hour > 10 && Hour < 17) || Hour > 19) {   IfNotifications.sendNotification.skip(""Outside of commuting hours"") }"
if New service alert on Rapid Ride B line (trigger_service: King County Metro) then Send me an SMS (action_service: SMS),"var Hour = Meta.currentUserTime.hour()   if (Hour <7 || (Hour > 10 && Hour < 17) || Hour > 19) {   Sms.sendMeText.skip(""Outside of commuting hours"") }"
if New service alert on Rapid Ride D line (trigger_service: King County Metro) then Post to channel (action_service: Slack),"var Hour = Meta.currentUserTime.hour()   if (Hour < 7 || Hour > 10) {   Slack.postToChannel.skip(""Outside of commuting hours"") }"
if Disconnects from a Bluetooth device (trigger_service: Android Device) then Set ringtone volume (action_service: Android Device),"if (Trigger.DeviceName.indexOf(""Gear"") == -1) {AndroidDevice.setDeviceVolume.skip(""Déconnection non due à la montre"")}"
if Event from search starts (trigger_service: Google Calendar) then Set thermostat comfort profile until next transition (action_service: ecobee),"if (GoogleCalendar.eventFromSearchStarts.Title.toUpperCase() != ""WORK"") {   Ecobee.climateNextTransition.skip() }"
if New tweet by a specific user (trigger_service: Twitter) then Save for later (action_service: Pocket),var linkRegex = /newsletter.*(https:\/\/\S+)/ var matchResult = linkRegex.exec(Twitter.newTweetByUser.Text);  if (matchResult && matchResult.length === 2) {   Pocket.readItLater.setUrl(matchResult[1]); } else {   Pocket.readItLater.skip('Likely not Money Stuff'); }
if Any card purchase at a merchant (trigger_service: Monzo) then Send a rich notification from the IFTTT app (action_service: Notifications),"var format = 'hh:mm:ss'    var beforeTime = moment('11:30:00', format);  var afterTime = moment('13:30:00', format);    if (Meta.triggerTime.isBetween(beforeTime, afterTime) && Meta.triggerTime.isoWeekday() < 6) {    var PMT = parseFloat(Monzo.cardPurchaseWithMerchant.AmountInAccountCurrency) * 20;    var r = 0.07;    var n = 12;    var t = 10;    var amount = PMT * ((Math.pow((1 + r/n),(n*t)) - 1) / (r/n)) * (1+r/n)    var url = ""https:   IfNotifications.sendRichNotification.setMessage(""If you buy your lunch every work-day in the next 10 years, you've potentially wasted "" + Monzo.cardPurchaseWithMerchant.AccountCurrencySymbol + amount.toFixed(2));    IfNotifications.sendRichNotification.setLinkUrl(url);  }  else  {    IfNotifications.sendRichNotification.skip();  }"
if Any card purchase at a merchant (trigger_service: Monzo) then Send a rich notification from the IFTTT app (action_service: Notifications),"var format = 'hh:mm:ss'    var beforeTime = moment('11:30:00', format);  var afterTime = moment('13:30:00', format);    if (Meta.triggerTime.isBetween(beforeTime, afterTime) && Meta.triggerTime.isoWeekday() < 6) {    var amount = parseFloat(Monzo.cardPurchaseWithMerchant.AmountInAccountCurrency) * Math.pow(1.000191780821917808,3650);    var url = ""https:   IfNotifications.sendRichNotification.setMessage(""You just wasted a potential "" + Monzo.cardPurchaseWithMerchant.AccountCurrencySymbol + amount.toFixed(2) + "" by buying your lunch"");    IfNotifications.sendRichNotification.setLinkUrl(url);  }  else  {    IfNotifications.sendRichNotification.skip();  }"
if New tweet by a specific user (trigger_service: Twitter) then Send a notification from the IFTTT app (action_service: Notifications),"var timeOfDay = Meta.currentUserTime.hour()  if (timeOfDay >= 22 || timeOfDay < 8 ) {      IfNotifications.sendNotification.skip(""Too late"") } else {      Feedly.createNewEntryFeedly.skip(""I already know"") }"
if Any new note (trigger_service: Note widget) then Log sleep (action_service: iOS Health),"var values = DoNote.doNoteNewCommandCommon.NoteText.split("" "", 2) if (values.length > 1) {   IosHealth.logSleep.setAsleepAt(values[0])   IosHealth.logSleep.setDateSleepEnded(values[1]) } else {   IosHealth.logSleep.skip(""Enter time feel asleep and time awoke, separated by a space"") }"
if New file in your folder (trigger_service: Google Drive) then Post to channel (action_service: Slack),if (Trigger.Filename.match(/~\$/i)) {  Slack.postToChannel.skip('Temp File Was Skipped')  }
if Opened (trigger_service: SmartThings) then Call my phone (action_service: Phone Call (US only)),"var hour = Meta.currentUserTime.hour()  if (hour < 22 && hour > 6) {   PhoneCall.callMyPhone.skip(""Not during sleeping hours"") }  else{  }"
if Any new SMS received (trigger_service: Android SMS) then Post to channel (action_service: Slack),"var text = AndroidMessages.receivedAMessage.Text.replace(/잔액.*/g, """");  Slack.postToChannel.setMessage(text);"
if New story (trigger_service: Slashdot) then Send a notification from the IFTTT app (action_service: Notifications),"var title = Trigger.EntryTitle var subject = 'Ask Slashdot'  if (title.indexOf(subject) < 0) {    IfNotifications.sendNotification.skip(""Not an 'Ask Slashdot' article"") }"
if Every day of the week at (trigger_service: Date & Time) then List all tasks in a list (action_service: Google Tasks),"Slack.postToChannel.setTitle("":inbox_tray: Tasks for today"")  let message = """"; let today = Meta.currentUserTime;  GoogleTasks.listAllTasks.forEach(task => {   let task_due = moment(task.Due);   if (today.isSame(task_due, 'day')) {     message = message + `:black_square_button: *${task.Title}*\n_Notes:_ ${task.Notes}\n\n`;   } })  if (GoogleTasks.listAllTasks.length === 0) {     Slack.postToChannel.skip(); }  if (message.length === 0) {   message = ""No tasks are due today :party:"" }  Slack.postToChannel.setMessage(message);"
if New light rail advisory (trigger_service: NJ Transit) then Post to channel (action_service: Slack),"var Hour = Meta.currentUserTime.hour() var Day = Meta.currentUserTime.day()  if (Day==6 || Day==7) {   Slack.postToChannel.skip(""Not a weekday"") }  else if (Hour < 7 || Hour > 9) {   Slack.postToChannel.skip(""Not morning commute hours"") }"
if Every day of the week at (trigger_service: Date & Time) then Post to channel (action_service: Slack),var now = Meta.triggerTime var day = now.format('DD') var month = now.format('MM') var year = now.format('YYYY')  var url = 'http: var message = `HSH Nordbank Wochenbarometer für ${Meta.triggerTime.format('LL')}:\n${url}`  Slack.postToChannel.setMessage(message)
if Current temperature rises above (trigger_service: Weather Underground) then Activate Scene (action_service: Hunter Douglas PowerView),"var hour = Meta.currentUserTime.hour()     if (hour >= 8 && hour < 20) { (""Not nighttime"") }"
if New feed item (trigger_service: RSS Feed) then Send a notification from the IFTTT app (action_service: Notifications),"const content = Feed.newFeedItem.EntryContent  IfNotifications.sendNotification.setMessage(   content        .replace(/\<[^\>]+\>/mg, """")        .match(/Current Air Quality:[\s\S]*(?=Agency:)/m)[0]        .trim()        .replace(/\s\s+/mg, "", "") )"
if New feed item (trigger_service: RSS Feed) then Send a notification from the IFTTT app (action_service: Notifications),"const content = Feed.newFeedItem.EntryContent  IfNotifications.sendNotification.setMessage(   content        .replace(/\<[^\>]+\>/mg, """")        .match(/Current Air Quality:[\s\S]*(?=Agency:)/m)[0]        .trim()        .replace(/\s\s+/mg, "", "") )"
if New feed item (trigger_service: RSS Feed) then Send a notification from the IFTTT app (action_service: Notifications),"const content = Feed.newFeedItem.EntryContent  IfNotifications.sendNotification.setMessage(   content        .replace(/\<[^\>]+\>/mg, """")        .match(/Current Air Quality:[\s\S]*(?=Agency:)/m)[0]        .trim()        .replace(/\s\s+/mg, "", "") )"
if New feed item (trigger_service: RSS Feed) then Send a notification from the IFTTT app (action_service: Notifications),"const content = Feed.newFeedItem.EntryContent  IfNotifications.sendNotification.setMessage(   content        .replace(/\<[^\>]+\>/mg, """")        .match(/Current Air Quality:[\s\S]*(?=Agency:)/m)[0]        .trim()        .replace(/\s\s+/mg, "", "") )"
if New feed item (trigger_service: RSS Feed) then Send a notification from the IFTTT app (action_service: Notifications),"const content = Feed.newFeedItem.EntryContent  IfNotifications.sendNotification.setMessage(   content        .replace(/\<[^\>]+\>/mg, """")        .match(/Current Air Quality:[\s\S]*(?=Agency:)/m)[0]        .trim()        .replace(/\s\s+/mg, "", "") )"
if New feed item (trigger_service: RSS Feed) then Send a notification from the IFTTT app (action_service: Notifications),"const content = Feed.newFeedItem.EntryContent  IfNotifications.sendNotification.setMessage(   content        .replace(/\<[^\>]+\>/mg, """")        .match(/Current Air Quality:[\s\S]*(?=Agency:)/m)[0]        .trim()        .replace(/\s\s+/mg, "", "") )"
if Tomorrow's weather report (trigger_service: Weather Underground) then Send a notification from the IFTTT app (action_service: Notifications),if (parseInt(Weather.tomorrowsWeatherAtTime.LowTempFahrenheit) > 40) {    IfNotifications.sendNotification.skip();  }
if Today's rainfall measurement (trigger_service: Netatmo Weather Station) then do not water (action_service: Netro),if(parseFloat(Netatmo.rainTodayAmount.MeasuredRainfallMM)<5){   Netro.noWater.skip() }
if Button press (trigger_service: Button widget) then Send yourself an email (action_service: Gmail),"var startTime = moment('01:00 pm', ""HH:mm a"");    var stopTime  = moment('11:00 am', ""HH:mm a"");                              var startTimeMinutes = startTime.minutes() + startTime.hours() * 60;    var stopTimeMinutes  = stopTime.minutes()  + stopTime.hours()  * 60;    var triggerTimeMinutes = Meta.triggerTime.minutes() + Meta.triggerTime.hours()* 60;       if (startTimeMinutes == stopTimeMinutes)     {      Gmail.sendYourselfAnEmail.skip(""Start and end times cannot be the same - start is ""+startTime.format('LT')+"" and end time is ""+stopTime.format('LT'));    } else {          var doThat = new Boolean(false);      var whatsup  = ""'That' has been skipped"";          if ((startTimeMinutes<stopTimeMinutes)              && (triggerTimeMinutes >= startTimeMinutes               && triggerTimeMinutes <= stopTimeMinutes))       {        doThat = Boolean(true);        whatsup  = ""range within a single day"";      }           else if ((startTimeMinutes>stopTimeMinutes)             && (triggerTimeMinutes > startTimeMinutes              || triggerTimeMinutes < stopTimeMinutes))       {        doThat = Boolean(true);        whatsup  = ""range spans midnight"";      }        if (doThat == false)      {         Gmail.sendYourselfAnEmail.skip(""Event happened outside time range ("" + whatsup +"") - time of trigger was ""+Meta.triggerTime.format('LT')+"", but start time to allow the action is ""+ startTime.format('LT') + "" and stop time is ""+ stopTime.format('LT') + "" Debug info: minutes are ""+triggerTimeMinutes + "" "" + startTimeMinutes + "" "" + stopTimeMinutes);     }          }"
if Standby mode entered (trigger_service: WeMo Insight Switch) then Add row to spreadsheet (action_service: Google Sheets),"var event = 'Standby'  var sname = WemoInsightSwitch.attributeINSIGHTSTANDBYN.SwitchName  var eventAt = WemoInsightSwitch.attributeINSIGHTSTANDBYN.SwitchedToStandbyAt  var codeRanTime = Meta.currentUserTime.format('MMMM DD YYYY hh:mm:ss a')  var triggerTime = Meta.triggerTime.format('MMMM DD YYYY hh:mm:ss a')  GoogleSheets.appendToGoogleSpreadsheet.setFormattedRow(sname + '|||' + event + '|||' + eventAt + '|||=DATEVALUE(SUBSTITUTE(""' + eventAt + '"","" at "","" ""))+TIMEVALUE(SUBSTITUTE(""' + eventAt + '"","" at "","" ""))|||' + codeRanTime + '|||=DATEVALUE(""' + codeRanTime + '"")+TIMEVALUE(""' + codeRanTime + '"")|||' + triggerTime + '|||=DATEVALUE(""' + triggerTime + '"")+TIMEVALUE(""' + triggerTime + '"")')"
if Switched on (trigger_service: WeMo Insight Switch) then Add row to spreadsheet (action_service: Google Sheets),"var event = 'On'  var sname = WemoInsightSwitch.attributeINSIGHTONN.SwitchName  var eventAt = WemoInsightSwitch.attributeINSIGHTONN.SwitchedOnAt  var codeRanTime = Meta.currentUserTime.format('MMMM DD YYYY hh:mm:ss a')  var triggerTime = Meta.triggerTime.format('MMMM DD YYYY hh:mm:ss a')  GoogleSheets.appendToGoogleSpreadsheet.setFormattedRow(sname + '|||' + event + '|||' + eventAt + '|||=DATEVALUE(SUBSTITUTE(""' + eventAt + '"","" at "","" ""))+TIMEVALUE(SUBSTITUTE(""' + eventAt + '"","" at "","" ""))|||' + codeRanTime + '|||=DATEVALUE(""' + codeRanTime + '"")+TIMEVALUE(""' + codeRanTime + '"")|||' + triggerTime + '|||=DATEVALUE(""' + triggerTime + '"")+TIMEVALUE(""' + triggerTime + '"")')"
if Switched off (trigger_service: WeMo Insight Switch) then Add row to spreadsheet (action_service: Google Sheets),"var event = 'Off'  var sname = WemoInsightSwitch.attributeINSIGHTOFFN.SwitchName  var eventAt = WemoInsightSwitch.attributeINSIGHTOFFN.SwitchedOffAt  var codeRanTime = Meta.currentUserTime.format('MMMM DD YYYY hh:mm:ss a')  var triggerTime = Meta.triggerTime.format('MMMM DD YYYY hh:mm:ss a')  GoogleSheets.appendToGoogleSpreadsheet.setFormattedRow(sname + '|||' + event + '|||' + eventAt + '|||=DATEVALUE(SUBSTITUTE(""' + eventAt + '"","" at "","" ""))+TIMEVALUE(SUBSTITUTE(""' + eventAt + '"","" at "","" ""))|||' + codeRanTime + '|||=DATEVALUE(""' + codeRanTime + '"")+TIMEVALUE(""' + codeRanTime + '"")|||' + triggerTime + '|||=DATEVALUE(""' + triggerTime + '"")+TIMEVALUE(""' + triggerTime + '"")')"
if Generate Detail Pet Activity Report (trigger_service: Link My Pet) then Quick add event (action_service: Google Calendar),var hour = Meta.triggerTime.hour()  var minute = Meta.triggerTime.minute()  var timeHour = 24    if(hour%timeHour > 0 && minute%15 > 0)    GoogleCalendar.quickAddEvent.skip()
if Generate Detail Pet Activity Report (trigger_service: Link My Pet) then Append to a text file (action_service: Dropbox),var hour = Meta.triggerTime.hour()  var timeHour = 24  var minute = Meta.triggerTime.minute()    if(hour%timeHour > 0 && minute%10 > 0 )    Dropbox.appendToTextFileDb.skip()
if Generate Detail Pet Activity Report (trigger_service: Link My Pet) then Add row to spreadsheet (action_service: Google Sheets),var hour = Meta.triggerTime.hour()  var hourString = hour.toString()        if(hour%24 > 0 )    GoogleSheets.appendToGoogleSpreadsheet.skip()
if Generate Pet Activity Report (trigger_service: Link My Pet) then Append to a document (action_service: Google Docs),var hour = Meta.triggerTime.hour()  var minute = Meta.triggerTime.minute()  var timeHour = 24    if(hour%timeHour > 0 && minute == 0)    GoogleDocs.appendToGoogleDoc.skip()
if Any card purchase (trigger_service: Monzo) then Create a detailed event (action_service: Google Calendar),"var Address = Monzo.cardPurchase.MerchantAddress       if (Address.length <= 0 || Address == "","" || Address =="", ,"" || Address =="", , ""|| Address =="", "") {       GoogleCalendar.addDetailedEvent.setLocation(""Online Transaction"")    }  else {      GoogleCalendar.addDetailedEvent.setLocation(Monzo.cardPurchase.MerchantName + "", "" + Monzo.cardPurchase.MerchantAddress)    }"
if Any card purchase at a merchant (trigger_service: Monzo) then Add reminder to list (action_service: iOS Reminders),"var reminderTime = Meta.triggerTime.add(2, 'h'); IosReminders.createReminderIosReminders.setAlarmDate(reminderTime.format(""M/DD/YYYY"") + "" at "" + reminderTime.format(""h:mm A""))"
if New event added (trigger_service: Google Calendar) then Create calendar item (action_service: Office 365 Calendar),"if(GoogleCalendar.newEventAdded.Title.length > 0)    Office365Calendar.createNewCalendarItem.setSubject(GoogleCalendar.newEventAdded.Title)  else    Office365Calendar.createNewCalendarItem.setSubject(""Untitled Event"")  if(GoogleCalendar.newEventAdded.Where.length > 0)    Office365Calendar.createNewCalendarItem.setLocation(GoogleCalendar.newEventAdded.Where)  else    Office365Calendar.createNewCalendarItem.setLocation(""Location unrecorded"")    Office365Calendar.createNewCalendarItem.setBody(""GBS-related work."")  Office365Calendar.createNewCalendarItem.setTime(GoogleCalendar.newEventAdded.Starts)"
if New story on SFGATE homepage (trigger_service: SFGATE) then Add item to Reading List (action_service: iOS Reading List),"var title = Trigger.EntryTitle var subject = 'Mission'  if (title.indexOf(subject) < 0) {    IosReadingList.createReadingListItem.skip(""Not related to the Mission"") }"
if Any outgoing phone call ends (trigger_service: Android Phone Call) then Create a detailed event (action_service: Google Calendar),"var s_length = parseInt(AndroidPhone.placeAPhoneCall.CallLength);  var endTime = moment(moment(AndroidPhone.placeAPhoneCall.OccurredAt, 'MMMM dd, YYYY at hh:mmA').add(moment(AndroidPhone.placeAPhoneCall.CallLength, 'seconds')), 'MMMM dd, YYYY at hh:mmA').toString();  var min = moment(moment(AndroidPhone.placeAPhoneCall.OccurredAt, 'MMMM dd, YYYY at hh:mmA').add(1,'minutes'), 'MMMM dd, YYYY at hh:mmA').toString();    if(s_length>120){    GoogleCalendar.addDetailedEvent.setEndTime(endTime);  }else{    GoogleCalendar.addDetailedEvent.setEndTime(min);  }"
if Task completed (trigger_service: Remember The Milk) then Quick add event (action_service: Google Calendar),"if(Rememberthemilk.taskCompleted.Tags.indexOf(""trackthis"") === -1) {   GoogleCalendar.quickAddEvent.skip(); } else {   let timestamp = moment(Meta.triggerTime)                   .format('MMMM Do YYYY, h:mma');   let list = Rememberthemilk.taskCompleted.List;   let taskName = Rememberthemilk.taskCompleted.Name;   let taskLink = Rememberthemilk.taskCompleted.LinkToTask;   let taskText = `${list}    GoogleCalendar.quickAddEvent.setQuickAdd(taskText); }"
if New event added (trigger_service: Google Calendar) then Create a calendar event (action_service: iOS Calendar),
